{"parts":[{"bytes":16777216,"name":"0000.part","sha256":"3f2a9c4e8b1d7f6a0c5e2b9d4a7f1c8e6b3d0a9f5c2e7b4d1a8f6c3e0b9d2a7f"},{"bytes":1048576,"name":"0001.part","sha256":"3f2a9c4e8b1d7f6a0c5e2b9d4a7f1c8e6b3d0a9f5c2e7b4d1a8f6c3e0b9d2a7f"}],"recording_id":"5d0c6f1e-3b7a-4f7e-9c51-2a8e4b6d1f03","recording_version":1,"tar_bytes":17825792,"tar_sha256":"3f2a9c4e8b1d7f6a0c5e2b9d4a7f1c8e6b3d0a9f5c2e7b4d1a8f6c3e0b9d2a7f"}
